{
  "created_at": "2026-08-16T19:43:17Z",
  "guild_id": "1538362418277908530",
  "id": "binding-discord-1538634197756022849",
  "parent_channel_id": "1538634193485963318",
  "platform": "discord",
  "schema_version": 1,
  "state": "active",
  "study_id": "study-003-nonlocal-affinity-dance",
  "thread_id": "1538634197756022849",
  "updated_at": "2026-08-16T19:43:17Z",
  "visibility": "private"
}
