{
  "created_at": "2026-08-22T17:28:10Z",
  "guild_id": "1538362418277908530",
  "id": "binding-discord-1540774361852551191",
  "parent_channel_id": "1538634193485963318",
  "platform": "discord",
  "schema_version": 1,
  "state": "active",
  "study_id": "study-001-memory-field",
  "thread_id": "1540774361852551191",
  "updated_at": "2026-08-22T17:28:10Z",
  "visibility": "private"
}
