{
  "created_at": "2026-08-17T16:34:35Z",
  "guild_id": "1538362418277908530",
  "id": "binding-discord-1538949174110851162",
  "parent_channel_id": "1538634194882924726",
  "platform": "discord",
  "schema_version": 1,
  "seed_id": "idea-three-dimensional-fieldwriting-ants-617e0720",
  "state": "active",
  "thread_id": "1538949174110851162",
  "updated_at": "2026-08-17T16:34:35Z",
  "visibility": "private"
}
