{
  "created_at": "2026-08-17T16:34:37Z",
  "guild_id": "1538362418277908530",
  "id": "binding-discord-1538949180385530057",
  "parent_channel_id": "1538634194882924726",
  "platform": "discord",
  "schema_version": 1,
  "seed_id": "idea-nonlocal-affinity-dance-b774404e",
  "state": "active",
  "thread_id": "1538949180385530057",
  "updated_at": "2026-08-17T16:34:37Z",
  "visibility": "private"
}
