{
  "created_at": "2026-08-22T17:48:01Z",
  "guild_id": "1538362418277908530",
  "id": "binding-discord-1540779590639943842",
  "parent_channel_id": "1538634193485963318",
  "platform": "discord",
  "schema_version": 1,
  "state": "active",
  "study_id": "study-002-scar-tissue",
  "thread_id": "1540779590639943842",
  "updated_at": "2026-08-22T17:48:01Z",
  "visibility": "private"
}
