{
  "created_at": "2026-08-22T17:20:47Z",
  "guild_id": "1538362418277908530",
  "id": "binding-discord-1540772740603318322",
  "parent_channel_id": "1538634193485963318",
  "platform": "discord",
  "schema_version": 1,
  "state": "active",
  "study_id": "study-004-three-dimensional-fieldwriting-ants",
  "thread_id": "1540772740603318322",
  "updated_at": "2026-08-22T17:20:47Z",
  "visibility": "private"
}
